{
  "hosapprovalversion": "0.2",
  "approval_id": "apr_55c1d0e9",
  "command_id": "cmd_7f3a91c2",
  "command_digest": "sha-256:f2fe580a85056adc14bf68409134801426517997d83e8f29f32438b115d983f9",
  "hostenant": "tenant_demo",
  "decision": "approved",
  "approver": "user:manager_a1",
  "approver_role": "front_office_manager",
  "decided_at": "2026-07-14T09:07:12Z",
  "expires_at": "2026-07-14T09:37:12Z",
  "policy": {
    "policy_id": "pol_front_office",
    "version": "2026-10-01"
  }
}
